Column1;Column2
Column1;Column2
"Ideas											";Tag
¿Pasar de ser pasivamente suicida a ser activamente suicida realmente me alivió? *¿Alguien más ha tenido esta sensación? ¿O lo ha encontrado relatable?;0
"He sido pasivamente suicida desde hace unos meses, pero ayer fue un día excepcionalmente horrible. Dormí hasta muy tarde, olvidé que tenía que ir a trabajar, no podía vestirme, no podía salir de casa, intenté arreglar mi bi	cicleta pero acabé rompiéndola aún más. Luego me entregué a casi to	dos mis vicios autosaboteadores (drogas, porno, comida de mierda, vide	ojuegos, de todo).";0
"Juro que algo se rompió. Lloré muchísimo durante todo el día y me pasé el resto de la noche leyendo febrilmente sobre el suicidio. De hecho, descubrí mi plan. Encontré un documento entero en el que se describen los detalles y se responde a todas las pequeñas preguntas que tenía (lo siento,	no compartir ni siquiera me preguntan), además de una opción de copia de seguridad en caso de que estoy lo suficientemente desesperado como para hacer algo más rápido. Por ahora, estoy en la etapa de adquirir los materiales y poner mis asuntos en orden.Desde que tengo mi método de suicidio resuelto, estoy en un estado de ánimo extrañamente optimista. Es una extraña paradoja. Finalizar mi plan de acción para acabar con mi vida me hizo sentir motivado para salir a vivirla. Estoy haciendo las tareas sin sudar, estoy bailando y escuchando música divertida, estoy recuperando partes de mi personalidad. Me he quitado un gran peso de encima.";0
Por lo que he oído, es habitual que la gente se muestre tranquila o alegre los días previos al intento. ¿Es eso lo que estoy experimentando? Tal vez sea porque ahora tengo una meta? ¿Porque mis días ya no parecen carecer de sentido como antes? O puede que por fin haya una vía de escape para liberarme de la mierda de vida que llevo. Ya no me siento tan atrapado y desesperanzado.;0
De todos modos, quería ver si esto alguien aquí tuvo una experiencia similar o quiere opinar sobre esta situación. Estoy activamente suicida por primera vez en mi vida y me siento mucho mejor después de que me di cuenta de mi método. ¿Cuál es el significado detrás de esto?;1
"El sistema escolar está hecho específicamente para ser un matadero de retrasados mentales como yo también podría suicidarme. Escucha, ya no tengo otra puta opción, la escuela, literalmente, sólo deja que los putos egoístas tengan éxito. Si no eres el tipo más seguro y diferente que pueden manejar, te joden, te mienten, abusan de su poder y te joden. Todo el	tiempo te echaránhumo por el culo sobre lo mucho que quieren que «triunfes».";1
"No estoy «triunfando», me estoy yendo al infierno. Siempre diciéndome que soy un «chico listo» ¿Qué tan estúpido crees que soy? ¿Honestamente crees que creo una palabra de lo que dices?	";0
La escuela no «se preocupa por ti» la escuela no quiere que tengas éxito, la escuela quiere que te caigas por la puerta en la graduación y mueras en las calles para que los de tu clase sean conocidos como la «gente mala».;0
"Sí, así que puede que me ahorque en un baño o algo así. Si tuviera un arma me pegaría un tiro en su oficina, sólo yo, obviamente. Estoy pensando que probablemente solo me cortare en los baños por ahora amigo estoy enfermo viviendo una vida de mierda podria haber hecho mucho mas pero claramente mi	sangre	es mi unica voz por aqui.¡JODETE MUNDO!""""				";1
"No mejora. Si dices eso, te odio. 28 años he estado atrapado en este miserable montón de mierda. He malgastado miles de dólares hablando con gilipollas idiotas que no hacen más que ahogarme con metáforas sobre lo bonita que	es la vida, ¡y es bonita para esos cabrones	porque NO SON YO! Todo lo que he probado no ha aliviado en absoluto esta maldita maldición. He mandado a la mierda a mi terapeuta y he tirado las pastillas por el retrete porque ya he terminado con todo. Y si dices que mejora, puedes irte a la mierda con un pincho de ferrocarril cubierto de ácido porque ni siquiera sabes si eso es verdad. Así que vete a la mierda tú y todos los que piensen que ayuda.";1
"""Estoy tan deprimido que mis razones para suicidarme son cada vez más lógicas en lugar de irracionales. Es como si se me ocurrieran razones por las que es más lógico suicidarme que seguir vivo.";1
Por qué ser una cáscara sin emociones cuando potencialmente podría reencarnarme en una vida más feliz?;1
Mis circunstancias son las razones de mi depresión, pero sólo hay tantas fuerzas externas que realmente puedes controlar.;1
Si la vida después de la muerte y Dios existen, eso hace que mi vida no tenga sentido, porque me voy a reencarnar en algún maricón inútil en la siguiente ronda. Y odio a la gente que NO SOY yo.;0
Si no hay dios o vida después de la muerte, entonces me avergüenzo de ser esta forma de vida de tipo simio lanza mierda en lugar de algo con inteligencia mejorada e invulnerabilidad;0
Ya no puedo usar la ficción como vía de escape porque me hace sentir que esos mundos son reales y que podría ir a ellos si me suicidara.;1
La gente que da vueltas sobre lo bonita que es la vida, curiosamente, hace que me den aún más ganas de suicidarme por lo absurda que es. En realidad no se lo creen, están bajo los efectos de la simple cafeína.;1
Si la fuente que todo lo ama es real y se siente mejor que estar vivo...bueno idk chicos. Pensé que la espiritualidad se suponía que me haría querer vivir, no convencerme de ir.;1
En resumen, el ser humano no puede decidirse y me da vergüenza seguiros el juego.;0
Si hubiera un botón para morir, lo pulsaría. Pero hacer algo sería demasiado trabajo.;1
"""En una hora me habré ido En una hora voy a acabar con mi vida.";1
Llevo demasiado tiempo sin hogar y k lucho cada día.;1
Tengo frío y hambre constantemente y mi;0
mente ya no puede más. He tomado mi decisión y me siento feliz porque sé que todo acabará pronto. No tengo nada más que decir pero buena suerte si estás leyendo esto.;1
"""Lo siento a mis padres, no fui lo suficientemente bueno";1
Lo siento por mis amigos, debería haber disfrutado un poco más de nuestros momentos;1
Lo siento por mi hermano pequeño, siento mucho haber sido el mejor hermano para ti;1
Lo siento por mi joven yo. Lo siento profundamente.;1
Lo siento por todos.;1
No puedo soportarlo más;1
"¿puedo morir si tomo una sobredosis de analgésicos? No sé si esto pertenece a este lugar, pero necesito consejo. mañana por mi decimoséptimo cumpleaños planeo tomar una sobredosis. mi vida es terrible odio todo me odio a mí misma tengo problemas mentales, lucho con autolesiones y pensamientos	suicidas todos los días. Ya no puedo	funcionar con normalidad. Ya	he intentado suicidarme tres veces por sobredosis de analgésicos, placebo, neurol y demás. Nunca he tenido nada peor que náuseas. Estoy planeando este intento para dentro de unas semanas, hace un mes compré 2 paquetes de paralen y 1 paquete individual de ibalgin. si me lo tomo todo (unos 70 comprimidos) y bebo alcohol, ¿realmente podría morir? Conozco los efectos secundarios y los posibles problemas de salud con el hígado y los riñones, etc., sinceramente me da igual. Sé que hay una pequeña posibilidad de morir, pero conozco casos en los que ocurrió y tomaron menos medicamentos. Yo tomé como mucho 20 paralens y no me sentí mal. por favor absténganse de estupideces, no digan que no debería hacerlo, que debería esperar tiempos mejores, etc. Realmente ya no puedo y no tengo el valor para suicidarme de una manera mas extrema.";1
mi cara me hace querer morir;0
"la odio la odio tanto que me dan ganas de llorar cada vez que la miro odio mirar a todas las chicas guapas cada vez que salgo odio mi nariz odio mi perfil lateral y mi estupida forma de cara me gustaria parecerme a una puta mujer me dan ganas de morirme. ¿Por qué demo	nios nací con esta cara?Odio tanto	mirarla. ¿Qué sentido tiene mi existencia si no soy guapa?	No importa cuánto me esfuerce, nunca importa porque soy fea de cojones.";1
"creo que acabo de perder la oportunidad de sentirme feliz alguna vez no creo que siga siendo una posibilidad para mí. las drogas pueden simularlo en cierto modo pero no son lo suficientemente buenas. no sé cómo sentirme feliz. no sé si siento lo que sienten los demás. algo falla en mí. me falta algo. quiero volver a casa pero estoy en casa. quiero volver a casa. quiero irme.""quiero irme.";1
"A la mierda ser «orgulloso» y «único» por ser trans. Quiero ser normal. Pero nunca lo seré. Estoy maldito a ser trans para siempre. Toda mi vida eso nunca cambiará. A la mierda con esto. Si no va a cambiar en toda mi vida, ""mejor que esa vida sea lo más corta posible.";1
"Toda mi familia inmediata ha muerto.  A los 36 años, intenté recuperar mi vida después de haber sido cuidadora durante más de 15 años. Lo intenté. Hice todo lo que pude tras la muerte de mi último familiar directo para corregir la trayectoria de mi vida. Estoy orgullo	sa de la lucha que di para re	cuperar mi vida. Sin hijos, sin perros, sin familia. Tengo un título y certificaciones. Agradezco lo que mi hermanastro ha hecho por mí. Llevo semanas solicitando trabajo. Una entrevista. Montones de rechazos. Los cuidadores no son tomados en serio por ninguna empresa. Incluso con familiares lejanos en empresas importantes, nada. Ya tengo mi plan. Voy a esperar hasta que todo esté absolutamente FUBAR e ir a un parque maravilloso y dejar ir. No tengo nada más que me retenga aquí. Nadie. Ninguna relación cercana.";0
"""Lo siento mamá sé que estoy siendo egoísta pero no quiero seguir viviendo así. No quiero despertarme mañana y vivir otro día así, luego otro, luego otro, luego otro. Esto no tiene fin. No quiero morir. Quiero vivir, quiero ser feliz, quiero viajar por el mundo algún	día. Pero nada de eso sucederá jamás. Estoy atrapada así. Sigo	esperando que alguien me salve pero eso nunca va a pasar, la vida no funciona así. Y estoy tan jodidamente cansada.";1
Tengo delante pastillas como para matar a un caballo y he escrito una nota. No fallaré esta vez, he aprendido de mi último fracaso.;1
Lo siento mamá, sé que esto te dolerá. Lo siento por ser una hija de mierda.;1
 Sí, algo está pasando, definitivamente están empezando a hacer efecto ahora. Mis piernas se sienten pesadas y me siento un poco cansado;1
"Varón con TDC, autismo, ansiedad severa y depresión severa, todo confirmado por múltiples psiquiatras. Sentencia de muerte social masculina. Joder. ¿Hay algo que hacer EXCEPTO suicidarme? No me apetece. Quiero una vida soci	al. Pero la gente huele la enfermedad en mí y huir. (Me ducho no es	mi olor real)	....Otro componente de la cosa olor	podría ser mi perfume de arándanos. Quiero oler a arándanos. Es un spritz en el aire no tiro la botella y es un olor a arándano suave no como saborizante de caramelo. A la mierda el suicidio pospuesto. Investigaré más el asunto de los arándanos.";0
"Creo que aunque superara todos mis problemas de salud mental, seguiría queriendo suicidarme por la mierda de mundo que hay.  La gente es tan gilipollas con los demás. Ojalá hubiera nacido en los 90, porque quizá tendría algunas habilidades sociales. Culpo a estos malditos dispositivos electrónicos. Y estoy harto de la puta política.				";1
"""Sólo otro «hombre negro enfadado» Tanta ira visceral. Tanto odio.	";0
No tengo más que odio por casi todo en mi campus universitario;0
Odio los pasillos;0
Odio el pelo en el lavabo del baño;0
Odio las malditas ardillas estúpidas;0
Odio las bicicletas veo;0
Odio que el supermercado de la universidad me cobre 20 céntimos por bolsa de mierda;0
Odio a los estudiantes internacionales que caminan por el carril bici;0
Odio el Chipotle que me da proporciones en miniatura;0
Odio las moscas en mi clase;0
Odio a las parejas que acaparan la sala de estudio;0
Odio el hecho de tener 5 clases en un día;0
Odio sentirme solo en un lugar en el que nunca estoy solo;1
Odio sentir que estoy aprendiendo mucho, sólo para hacer un examen y saber que no sé nada;0
"Odio a los estudiantes racialmente insensibles que responden anónimamente a las encuestas que preguntan a los estudiantes negros cómo se sienten en el campus con matad a todos los negros	";0
Odio ser negro aquí;1
Odio recibir sonrisas falsas allá donde voy;0
Odio que la gente evite sentarse a mi lado en un autobús abarrotado donde literalmente no hay sitio;0
Odio estar demasiado deprimido para concentrarme en mi trabajo y mantenerme despierto.;0
Odio estar demasiado ansioso para estar con gente durante largos periodos de tiempo y hacer amigos.;0
Odio ser una persona autista de alto funcionamiento sin diagnosticar a la que le cuesta adaptarse a los cambios.;0
"Odio sentir que tengo que ser perfecta para merecer estar en el campus.Odio trabajar el doble sólo para hacer cosas mediocres		";0
Odio haberme hecho amigo de personas que me traicionaron y dieron por sentada mi amabilidad;0
Odio que algunas de las personas a las que una vez llamé amigos sean racistas por lo bajo y me hayan insultado varias veces;0
Odio que siempre que se lo conté a alguien, la mayoría de mis amigos menospreciaron mis sentimientos y siguieron saliendo con ellos hasta que descubrieron lo gilipollas que eran en realidad;0
Odio haberlos perdonado a todos.;0
Odio que mis únicos amigos de verdad ya se hayan graduado o estén demasiado ocupados para quedar conmigo.;0
Odio pedir ayuda a la gente y sentir que soy una carga.;1
Odio que la única chica que era un interés romántico resultara ser una bebedora y fumadora empedernida que sólo me hablaba porque había roto con su ex maltratador.;0
"Odio saber que voy a graduarme y entrar en el mundo real, donde voy a ser responsable de mí mismo		";0
Odio saber que voy a volver a casa a una ciudad plagada de delincuencia donde siempre tendré que vigilar mis espaldas y todo el mundo es siempre malo.;0
Odio tener que pasar por delante de tanta gente sin hogar en mi ciudad sabiendo que no podré hacer mucho para ayudarles.;0
Odio que Internet me siga alimentando con contenidos racistas y de la Manosfera;0
Odio lo reñidas que van a ser estas elecciones;0
ME SIGUEN JODIENDO LA SANIDAD MENTAL ME VOY A SUICIDAR ;1
"""Los últimos 13 años he estado procrastinando mi suicidio Eso es todo lo que he estado haciendo, todo lo que ha estado sucediendo, aparte de los acontecimientos ligeramente distractores que he observado a través de la niebla. He hecho muchos «progresos» con mi salud mental, sigo esforzándome	al máximo cada día, porque mi dolor no es tan malo como el posible dolor de mi familia. Así que voy a seguir existiendo, pero no importa lo que haga, no veo esperanza. Me he sentido muerta, como un fantasma, durante mucho tiempo y las drogas han sido el único momento en que he escapado de este sentimiento por poco tiempo. Me siento distante y aislada, por mucho que derrame mi «alma» ante la gente, por muy vulnerable que haya aprendido a ser. Estoy en el limbo, teniendo que ver cómo otras personas forman conexiones entre sí, quizá conmigo, pero en realidad, estoy lejos, muy lejos.";1
"No importa cuánto intentes llenar tu vida de belleza, si estás mirando a través de unas gafas de color mierda.	";1
"Siempre estoy en modo de espera. Sé que aún no es mi momento y que no debería acelerarlo. Pero estoy siendo honesto conmigo mismo. Siempre estoy esperando, siempre deseando una cosa, y es escapar por fin de esta prisión de	""mi mente una vez que muera.";1
"Estoy pensando en suicidarme sólo tengo 16 y soy obeso. Y todo el mundo a mi alrededor me lo recuerda	";1
"""No tengo que conducir a casa estoy muy bien vestido para mis fotos de graduación que acabo de hacer con. Luché con mis lágrimas para maquillarme y aún así me veía horrible. Nunca seré lo suficientemente buena.";0
Tengo mi billetera, llaves, auto... En serio, podría conducir tan lejos como mi auto me lleve y nunca volver. No quiero suicidarme exactamente, pero podría... abandonarlo todo. Morir de hambre eventualmente. Vivir sin hogaren las calles hasta que alguien me mate.. Podría dejarlo todo;1
lo siento hola, lo siento, no tengo a nadie con quien hablar en la vida real, pero me gustaría que todo se detuviera, no creo que quiera morir, sólo quiero desaparecer y no estar aquí nunca más. ;0
"""me siento tan patetico que solo quiero morirme nunca he tenido novia, probablemente nunca la tendre. me siento tan solo y hambriento de contacto que duele. todo lo que quiero es que alguien me ame para poder amarlos de vue	lta. tengo tanto amor dentro de mi pero puedo sentirlo fermentando	lentamente en	odio. me molesta tanto que esto este pasando pero no puedo detenerlo";1
"no entiendo que hay en mi que sea tan repulsivo para las mujeres. todos los chicos que conozco ya han tenido una relacion, excepto yo. o me hacen amigos o me ignoran completamente, me hace sentir como si apenas fuera un ser humano. ni siquiera se como puedo ilusionarme tanto como para seguir intentandolo,  pero cada vez que lo hago solo resulta en mas fracaso	.tampoco tengo muchos amigos, asi que paso la mayor parte del tiempo solo en el ordenador. mi vida tiene muy poco valor para nadie. realmente me gustaria poder morir en paz y sin dolor mientras duermo esta noche, de todas formas ya voy a morir solo.";1
"""Sí, a la mierda.  Quiero cortar. Necesito cortar. Si no puedo vivir una vida sin cortar entonces qué. Es. El. Punto";1
He terminado. Estoy harta. Estoy harto de tratar de mejorar y luego chocar y ser peor de lo que era antes.;1
"Simplemente ya no tiene sentido. No me importa si tengo una familia o un novio. Si descubro que estoy embarazada lo haré. Si descubro que no estoy embarazada probablemente esperaré un poco para poder poner una buena nota. D	e cualquier manera, estoy muerta. Soy egoísta. Ya no me importa. No me siento mal. No será mi problema una vez que esté muerto. Lo he superado. Lo	he superado todo. Lo he superado, joder. No puedo seguir con esto. No puedo seguir siendo enviado a la sala de psiquiatría. Me haré lo que quiera y luego saltaré. Ya no me importa una mierda. Quiero mutilar mi cuerpo.";1
¡¡Gracias!! ¡¡¡Bye!!! ??;1
tengo las pastillas estoy cansado, tengo tantas ganas de hacerlo.;1
"""Rezando para tener una enfermedad terminal ¿Alguna vez has dicho allí y acaba de esperar en todo en el universo que usted envejece tiene alguna enfermedad incurable con semanas de vida";1
Ese es el punto en el que me encuentro ahora. Me he rendido mentalmente. Mi vida es sólo una serie de cosas que hay que hacer a continuación para todo el mundo y el perro de mierda, mientras que nadie se preocupa lo suficiente como para tratar de ayudar de manera que en realidad sería útil. Estoy cansado de que la gente;1
"Diciendo que lo entienden porque nadie lo entiende. Vivo mi vida en un estado constante de estrés, ansiedad y lucha o huida. Tengo tanta presión en la cabeza que físicamente no puedo relajarme. El sonido de alguien llamándo	me o incluso el ladrido del perro es suficien	te para ponerme al límite. Hago todo lo que puedo para ser pac	iente y no perder los estribos	cuando lo único que quiero es gritar a pleno pulmón. Cada día estoy más agotada mentalmente por contenerme e intentar mantener la compostura.  Todos los intentos que he hecho para salir de este mundo han fracasado (para mi consternación), así que ahora sólo espero que por algún milagro tenga alguna enfermedad incurable de rápido desarrollo. ";1
"estoy siendo culpa tripped en seguir con vida??? ¿se considera culpa tripping incluso im 13f y ayer yo estaba pasando por ella bro?? yo estaba al borde del suicidio y mi hermana me vio llorando y le dijo a mi mamá que estaba llorando así que ella subió las escaleras y yo directamente le dije que iba a suicidarme y ella, literalmente, sólo dijo «ok vamos a hacerlo juntos» y me ""puse un poco enojado porque wtf? ? y entonces ella empezó a gritar acerca de lo mucho que hace por mí y mierda idk entonces ella empezó a llorar y me dijo que seguir adelante y hacerlo y dijo que si lo hacía ella lo haría a como fs sólo me hizo sentir peor y idk qué hacer";1
"Desearía que mis problemas crónicos de salud me mataran, tengo tanto dolor cada maldito día debido a la artritis psoriásica. Tengo la enfermedad degenerativa del disco en la totalidad de mi columna torácica y lumbar, L4 se está deslizando sobre L5 lentamente con el tiempo, mis articulacion es	facetarias están degenerando desde t10 hacia abajo, todo está empezando a fusionarse ""y ahora en la parte superior de toda esta mierda ahora tengo levoscoliosis toracolumbar mierda que está haciendo que mi espalda duele aún más. Pero con todo eso y las demás gilipolleces de mi vida nada de lo que tengo me matará. Me dejará lisiado y me causará una agonía interminable hasta el día en que me muera, pero oye, no es lo suficientemente bueno estar atascado con eso, no, ni siquiera puedo conseguir nada para tratar mi dolor tampoco. Acabo de recibir una serie de inyecciones en la columna vertebral que tal vez funcionaron ligeramente durante 10 días. Y quieren seguir haciéndolas. Quiero decir que a quién le importan los efectos secundarios a largo plazo del uso frecuente de esteroides, a quién le importa si la cagamos puede quedar paralizado de por vida. Pero no, incluso el tramadol es demasiado. Dios, quiero salpicar mi cerebro en el techo de su oficina. Tal vez les importaría una mierda si alguien les disparara un arma por su dolor. Con un poco de suerte mi sistema inmunológico decidirá ser peculiar e ir tras mi corazón. Eso rara vez pasa con la PSA. Dios, ojalá pasara.";1
"""Querido mundo: ¿Por qué nací? ¿Qué propósito me trajo aquí?";1
¿Me recordará alguien cuando desaparezca?;1
La vida no es más que una batalla, una lucha sin fin;0
Sin embargo, elegí la bondad, elegí el amor en esta vida.;0
Sonreí a través del dolor, pero nunca me vieron;0
Criticado, dejado de lado y abandonado a su suerte;1
Lo que queda, es la esperanza desvaneciéndose como un sueño;0
Mientras estoy solo, deseando que las cosas hubieran sido;0
La esperanza una vez me ató a esta tierra;0
E incluso ahora, todavía sueño con el valor;0
Una paz que me libere de esta noche;0
Un descanso final, un lugar de luz;0
Mis sueños se han desmoronado;0
Di tanto, pero perdí mi corazón;0
La esperanza que tenía de que las cosas cambiarían;0
Se ha desvanecido, ahora distante, distanciada.;0
Lo he perdido todo, a los que quería;0
Nacido en un mundo al que no puedo adherirme.;0
He buscado y vagado, cerca y lejos;0
Buscando la felicidad como una estrella fugaz;0
Tal vez se encuentra más allá de este lugar;0
Un mundo donde el amor no se borra;0
Tal vez los árboles, la hierba, la tierra;0
Son almas como la mía, buscando renacer;0
Tal vez seré un árbol algún día;0
O yacer en las rocas donde juegan las aguas;0
Donde el calor me envuelve como un amigo perdido;0
Mientras miro hacia arriba, esperando el final;0
Anhelo el amor, las manos que sostienen;0
Tan fuerte como mi corazón se enfría;0
Ojalá hubiera saltado, ojalá hubiera volado;0
Para alcanzar el lugar donde los sueños podrían haber crecido;0
Pero el destino, al parecer, no fue tan amable;0
Este mundo girará, dejándome atrás;0
Tengo miedo, me duele, no quiero dolor;1
Sin embargo, todavía mi cuerpo se defiende, en vano.;1
¿Por qué mi corazón aún late, aún se romper;0
¿Por qué sangra cuando no puedo soportar;1
La carga de esta lucha hueca;0
Solo en mi mente como la oscuridad de la noche;0
Estoy cansado, roto, perdido en lágrimas;1
Llorando a través de estos interminables años;1
Que aquellos que amo encuentren paz, encuentren gracia;0
Donde yo no pude llenar ese espacio vacío;0
Vive por mí - vive como yo no pude;1
Prosperen en formas que he olvidado;0
Y cuando me haya ido, por favor continúen;1
Sabiendo que estoy donde pertenezco;0
"Que nos encontremos de nuevo, donde el mal se convierte en bien		";1
En otra vida, donde los corazones se reúnen;1
Con este último adiós, cierro mis ojo;1
Dejando atrás todo el dolor y las mentiras;1
En la tranquilidad del más allá, te esperaré allí;1
Donde la paz y el amor puedan reemplazar la desesperación;0
Por todo lo que hice mal y no pude hacer bien;0
Tal vez en la otra vida, encontraré la luz.;1
"""No quiero ir a trabajar mañana no tengo que hacerlo y creo que todos sabemos lo que podría hacer para asegurarme de que nunca más tengo que preocuparme por el trabajo	";1
"He estado pensando en ello desde siempre. La última vez que cogí mi escopeta me dije a mi mismo que si la sacaba probablemente la mantendría fuera hasta que lo hiciera.	";1
La vida se hace cada vez más difícil. Hay una desconexión entre cuánto quieres algo, cuánto esfuerzo pones en algo y si tu vida mejora o no. Es casi al revés, cuanto más me esfuerzo peor me siento.;0
"Intento pensar en razones para vivir, pero ya no las tengo. La única razón por la que no me he comprometido del todo es porque no quiero joder esto como lo jodo todo. No quiero tener que sobrevivir con un dolor inmenso (más de lo normal, supongo) y no poder opinar sobre la duración de mi v	ida des	pués de hacer todo lo posible para que sea lo más corta posible";1
"Al igual que, los recursos sobre cómo apuntar y si es o no super handicap munición de puntería pesada sería más apreciado que realmente cualquier cantidad de «ayuda	";1
"Porque a menos que usted tiene un montón de dinero o un trabajo que no me dan ganas de morir, entonces eso no va a ayudar a""";1
