Column1;Column2
"Ya no quiero estar aquí tiré por la borda toda mi vida que iba tan bien debido a un episodio maníaco. Dije cosas horribles a familiares y amigos. Perdí un trabajo que habría sido una gran carrera para mí. Y lo más importante, simplemente no puedo vivir con la forma en que actué durante él. He estado deprimido desde julio, cuando finalmente salí de ella. Tamb	ién me dieron un dui durante ese tiempo, en el proceso de ir a través de la quiebra y dejar ir de otro trabajo. He perdido todas mis habilidades sociales, demasiado avergonzado para llegar a los amigos que perdí durante el episodio. Todos los días mis pensamientos consisten en no querer estar aquí. Espero encontrar una salida pronto porque se ha vuelto insoportable vivir con esta destrucción. Sobre todo escribo esto para desahogarme.";1
¿Puede alguien hablar conmigo, por favor?;0
"""Odio estar vivo no me gusta nada de la vida. No creo que vivir una vida merezca la pena. No hay historias que contar. Nada de lo que experimento es digno de reflexión, consideración o de ser considerado como una «historia»en absoluto.";1
Ya no amo a la gente. No tengo sentimientos hacia nadie. No me importa cómo se sienten los demás, lo que piensan, lo que creen. No quiero ayudarles ni aportarles valor.;1
No quiero aprender cosas nuevas sobre el mundo ni contribuir a él de manera significativa.;1
"No quiero seguir luchando para salir de la pobreza. Al otro lado de la colina no siento nada en absoluto. No me siento feliz de afrontar los retos de la vida.	";1
"No estoy agradecido por estar vivo. Estar agradecido por tener incluso las cosas más básicas de la vida no tiene ningún sentido porque esas cosas te las pueden arrebatar con la misma facilidad por casualidad. Por tanto, incluso tener un cuerpo sano es completamente in	útil e inmaterial. Alguien podría atropellarme y dejarme lisiado, o podría contraer cáncer y	quedar desfigurado a causa de una operación quirúrgica que me salvaría la vida. ¿De qué me serviría estar vivo si tuviera que hacer frente a ese tipo de pérdidas? Aún no he llegado a ese punto, pero siento que es inevitable.";1
"nunca me recuperaré de haber crecido como un niño raro/acosado. ha pasado tanto tiempo. yo era sólo un niño, pero ahora soy un adulto esperando que estos sentimientos me maten				";1
"""¿Qué hago REALMENTE a partir de ahora? Esto es una especie de Ave María para mí, estoy realmente en mi extremo de la ingenuidad y - francamente - simplemente no puede luchar contra el impulso de simplemente darse por vencido más";1
"He sufrido con estos pensamientos durante años, pero ahora algo en ellos es simplemente más claro y «se dio cuenta» si eso tiene sentido y estoy de vuelta a ver ningún futuro discernible para mí una vez más.								";1
"Si ayuda a los consejos que se basan en el Reino Unido, y gracias, incluso si usted acaba de leer esto y no puede / no desea reply??""";0
"Yo realmente no quiero estar aquí Ive llegado tan lejos, sin embargo, todavía estoy tan jodidamente atascado donde estaba para empezar. No sé ni lo que estoy haciendo honestamente. Estoy cansado de sentir la forma en que me siento. Me siento como un zombie muerto viviente. No siento una mierda. Nada. Cero. Nada de nada. 20 años de esta mierda, no puedo sopor	tarlo más.Me rindo. No me queda nada aquí.";1
"""No quiero crecer. No quiero estar solo. No quiero estar solo. No tengo nada por lo que vivir. Si no termino mudándome con mi amigo en enero, voy a terminar. Necesito que esta mudanza ocurra. No quiero estar sola otra vez.	Esta es mi única motivación para levantarme e ir a trabajar porque quiero	desesperadamente estar con esta persona. Estoy dispuesto a construir esta persona de nuevo si eso significa tener su presencia para consolarme y darme una razón para vivir. Él es lo único que me impide terminar. Aunque acabe engañándome, o me haga daño, o se suicide... al menos habría estado con él en mis últimos momentos. No estaría sola.";1
"Me he sentido tan sola toda mi vida. Tenía a mis padres, claro, pero no les caía bien. Nunca salí en ninguna foto familiar, nunca fui a fiestas familiares, se peleaban por quién tenía que sentarse a mi lado en los restauran	tes y entonces el que tenía que sentarse a mi lado miraba su cuerpo en dirección contraria a la mía. Nunca tuve amigos. Casi siempre se olvidaban de mi cumpleaños. Ahora tengo 21 años. Mi cumpleaños es el 19 de diciembre";1
Esta noche me mato, he hecho daño a demasiada gente. Es hora de que el mundo se deshaga de mí de una vez por todas. He manipulado, mentido y engañado a mi manera de conseguir lo que quiero y su alto tiempo que llega a su fin;1
"Yo (F 31, con sede en Alemania) me gustaría encontrar a alguien con quien hablar. Para compartir los pensamientos de los demás Hacer tan mal que me encuentro mirando las paredes de mi piso, la pantalla de mi teléfono, sin ser capaz de ejecutar las tareas más simples. Otra noche sola en un país que no es el mío. Sólo me gustaría hablar con	vosotros para entender lo que os molesta y deciros lo que me molesta a mí. Sólo para ayudarnos mutuamente (como yo interpreto este subreddit). Os mando un abrazo a todos.";0
He comprado una cuerda y voy a acabar con ella esta noche ya no puedo vivir como una persona inútil y sin amor. Desearía tener una pistola en su lugar para poder hacer un agujero en mi fea cara de mierda;1
"""Me encantaría que me contaras lo que encuentras bello / significativo en la vida. Estoy realmente atascado en este momento en una espiral de pensamientos terribles, que van desde no ver ninguna luz en el pasado o el futuro	, a mi cerebro tratando de hacer un «plan» encontra de mi voluntad. Estoy entrando en una espiral de una forma que nunca antes había entrado. (Para abreviar y simplificar).";0
Necesito una luz. Necesito un poco de esperanza. Necesito una *distracción* sobre todo;1
¿Qué es lo que más te gusta de la vida? ¿Qué te parece hermoso? ¿Qué tiene sentido? ¿Qué te hace *feliz*? Háblame de tus aficiones, de tu música favorita. Cualquier cosa.;0
(Nota al margen) Durante el último año he mirado este subreddit muchas veces, preguntándome qué decir, pero sintiéndome mal conmigo misma por sentir que debería publicar. No sé si es mi padre en mi cabeza diciéndome «estás bien, aguántate» o si es miedo a ser percibida. Pero ahora mismo tengo tan claro que necesito algún tipo deconexión. Interacción. Interacción. No lo sé.;0
"""¿Cómo se supone que voy a seguir así toda la vida? Tengo veintitantos años y acabo de empezar a procesar el abandono y los abusos de mi infancia, relacionándolos con mi depresión de por vida. Tuve un TDAH no diagnosticado mientras crecía, diagnosticado hace poco. La vida era muy dura, me comportaba de forma agresiva a pesar de tener una gran empatía y era muy  conflictiva. Creo que sentía que tenía que protegerme porque mi padre y mi hermano abusaron de mí a una edad temprana, y también porque tengo una característica que me convertía en el blanco en la escuela y en la calle. No podía manejar mis emociones en absoluto e intenté suicidarme por estrangulamiento a los 9 años. He tenido episodios ininterrumpidos de pensamientos suicidas la mayor parte de mi vida, desde el momento en que me acuesto hasta el minuto en que me despierto. Se deben a desencadenantes de estrés vital y a la sensación de que es mi única forma de escapar de mis problemas/sentimientos, pero también al hecho de despertarme después de unos días de intensa felicidad e hipomanía y sentir un dolor instantáneo en el pecho al inspirar con la aparición de la depresión. Son ciclos de horas, días y semanas. Hay una cantidad insana de cosas para entrar, pero es demasiado largo. Acabo de darme cuenta de estos patrones.";0
Esencialmente nadie sabe por lo que estoy pasando y desde fuera tengo una vida perfecta. Eso hace que todo parezca mucho más inválido. Realmente no sé qué me pasa. Estoy empezando a pensar que es inevitable que me quite la vida.;1
"""Quiero morirme pero no quiero entristecer a nadie Quiero morirme pero la idea de entristecer a mi pareja y a los miembros de mi familia es lo que me mantiene aquí.";1
Pienso en suicidarme todo el tiempo. Pero no paro. Sólo quiero que todo se detenga.;1
¿Cómo se siente Realmente quiero OD en relajantes musculares, pero tan asustado voy a sentirlo ... alguien sabe si es indoloro .. Sólo quiero ir sin dolor pronto;1
"""No puedo morir hasta después de Navidad No puedo dejar de pensar en el suicidio, pero también intento pensar en razones para aguantar";1
"Cada plan que escribo, lo contrarresto con algo que debo esperar.	";1
¿Planeas tirarte de un puente mañana? Bueno, no puedo hacerlo porque no habrá nadie para dar de comer a mis gatos por la noche.;1
¿Piensas tomar una sobredosis? Pero tengo antojo de comida china y la noche de la comida para llevar no es hasta el viernes.;0
¿Pienso ahorcarme? Pero tengo dos días libres en el trabajo y eso significa que puedo dormir hasta tarde, así que por qué no esperar hasta después.;1
"Sigo haciendo planes todo el tiempo. Todavía tengo muchas ganas de suicidarme. Pero no lo he hecho. Sigo aquí incluso para mierdas estúpidas como la comida china. No me jodas. Tenía que escribir esto para no olvidar todas las pequeñas cosas que me hacen seguir adelante. Tal vez ayude a alguie	n más también.";1
"""Mi Plan Voy a darle tres semanas, necesito atar mis cabos sueltos";1
Voy a suicidarme en unas tres semanas. Soy madre soltera, pero mis padres se llevarán a mi hija. Tengo dos gatos a los que mi madre adora, creo que se los llevará.;1
No le debo nada a mi trabajo, que se joda la América corporativa. Estoy indecisa sobre mi decisión porque sé que voy a ir al infierno y, francamente, me da miedo.;1
Planeo tomar un montón de warfarina la semana anterior para que mi sangre sea increíblemente delgada. Voy a ir al río, buscaré un sitio y me cortaré las venas.;1
Pensé en pegarme un tiro, pero qué desperdicio de arma.;0
Me duele tanto que ya no puedo respirar. Me estoy asfixiando. Dios debe tener un malvado sentido del humor.;1
"""Tomé las pastillas Finalmente tomé todas las pastillas y ahora me siento muy tembloroso y nervioso, pero no estoy seguro de si es sólo mi imaginación. Hoy temprano me caí y me aplasté el pene tan fuerte que sentí como si e	stuviera digiriendo extra rápido. Espero que	funcionen porque eso fue el colmo. Mi madre no paraba de decirme «déjame	ver tu pene, déjame ver tu pene para asegurarme de que está creciendo bien» y le dije que no y salí corriendo, y mi abuela estaba bloqueando las escaleras diciendo «vale, aguántalo, déjame asegurarme de que no está roto» y le dije que no porque ya soy mayor y no quiero que mi familia vea mi pene. Me di cuenta de que mi padre me había visto el pene antes (problemas con el tribunal de familia y todo eso).";1
Fui a la habitación de mi hermano pequeño y vi a todos sus amigos allí, a pesar de que él tiene 10 años y todos sus amigos tienen como 8-10, entré allí, jugamos y mi padre entró y revisó mi pene y todo estaba bien. Cenamos salchichas y fue la primera vez que cenaba con mi familia en 5 años. Por alguna razón no quiero estar vivo. Es demasiado trabajo y ya nunca me siento feliz. Siento que la felicidad es sólo una ilusión porque siempre conduce a la decepción final. Todo ser vivo en este mundo algún día llegará a su fin...;0
"Compañera de trabajo Compañera de trabajo con discapacidad moderada, ha estado hospitalizada antes. Le aterroriza volver al hospital... sufrió malos tratos la última vez que estuvo ingresada. La convencí y conseguí que me prometiera una semana hasta que volvamos a trabajar juntos, entonces podremos ponernos en contacto. Necesito conseguirle ayuda, pero ella	no confía en la línea directa ni en la policía después de lo que pasó. Algún consejo, no soy un denunciante obligatorio pero no quiero que se entregue a la oscuridad. ¿Hay alguna otra línea a la que pueda llamar?";0
"""Aunque hoy estarán de luto, mañana estarán en paz Hoy mis padres (con suerte) se irán de compras y mis hermanos realmente no pueden detenerme porque están en el extranjero, así que voy a aprovechar la oportunidad para saltar desde un paso elevado hoy. En realidad no he conocido a nadie en la vida real, pero a la gente que he conocido por Internet al menos deb	ería decírselo, mejor que dejarles preguntándose qué me ha pasado.";1
"Sé que el suicidio es terrible para los que se quedan atrás, pero estoy seguro de que todos los que me conocen y se preocupan por mí lo superarán cuando me haya ido. De todas formas, no soy tan importante.""						";1
Cada momento de mi vida es dolor y quiero que termine. No puedo más. Soy tan miserable. Con mi virginidad. Con mi trabajo. Mi vida social. Mi ansiedad, depresión, dismorfia corporal, autismo, TDAH. Ya no puedo hacer esto. Siento que mi vida ha terminado a los 23 años.;1
hoy tomé café estaba delicioso me encanta;0
mi gato es mi mejor amigo, me abraza y me hace feliz;0
me encanta comer hamburguesas son deliciosas;0
"desayunar pan es un objetivo, pero es mejor con miel y mantequilla SU COMBO	";0
quiero jugar con mi perro en la nieve pero eso no pasa donde yo vivo;0
"me casaré con mi novia es mi compañera y es preciosa, la elegida para pasar mi vida con ella	";0
los coches son tan rápidos, me pregunto lo difícil que debe ser entrenar reacciones rápidas para ser un super piloto de F1;0
mi deseo es viajar por todo el mundo y hacer muchos amigos;0
ver peliculas como las que disney hacia hace años es un puch de nostalgia, quiero volver a verlas todas con mi familia;0
vacaciones en verano caluroso en bahamas, recuerdos maravillosos;0
